type,thread_id,id,title,body,created_utc,score,subreddit,author
comment,3t60rj,osx43w,,Thank you for sharing your experience. These conversations are how we build momentum for change. The real barrier isn't policy — it's culture. Hiring managers need to believe in skills-based approaches. The problem is that 'specialized experience' is often just code for 'has a degree.',2023-07-12 08:52:02,3,FedEmployees,public_servant
post,nvuprt,nvuprt,Is the Schedule A hiring authority being used for skills-based roles?,My experience going through the Pathways program showed me how much the federal government values credentials over capability. The RIF process is brutal and seems to penalize newer employees regardless of their actual skills or contributions. HHS is going through massive changes right now and it's not clear how hiring reform fits into the picture.,2023-07-12 17:57:01,23,FedEmployees,former_teacher_18
comment,pcn9t8,4f2k1x,,"I think the apprenticeship model is the most promising pathway for non-degree candidates. I know several people who were RIF'd and are now making more money in the private sector. Silver lining, I guess.",2023-07-12 18:08:24,24,feddiscussion,cyber_fed_66
comment,3z6bz8,3m55iz,,"The irony is that federal HR specialists themselves often don't have HR degrees. My team just hired someone through a skills assessment pilot and they're one of our best performers. The biggest gap I see is in mid-career transitions. The system doesn't know what to do with career changers. I went from enlisted military to GS-9 with no degree. The system can work, but it's harder than it should be. Structured interviews were a game-changer for our hiring panel. Much more equitable.",2023-07-14 16:30:21,18,jobs,budget_hawk
post,gox22i,gox22i,HHS just restructured — anyone know what's happening with hiring?,I went through a RIF in 2024 and it was the most stressful experience of my career. HHS is going through massive changes right now and it's not clear how hiring reform fits into the picture.,2023-07-15 22:43:00,7,recruiting,fed_employee_50
comment,zlm72j,i0835t,,The GS system was designed for a different era. Time to modernize. This is why I left federal service — the bureaucracy around hiring and promotion was suffocating.,2023-07-25 04:39:02,6,govfire,tech_to_fed_46
comment,krcppr,8wobir,,"Coming from healthcare into federal service, the skills translation was the hardest part. I've worked in three different agencies and the hiring culture varies wildly between them. I went from enlisted military to GS-15 with no degree. The system can work, but it's harder than it should be.",2023-07-25 14:47:46,21,FedEmployees,talent_scout
comment,gox22i,c2jwjj,,The GS system was designed for a different era. Time to modernize. The real question is whether skills-based hiring survives the next administration change.,2023-07-29 09:54:23,4,govfire,telework_fan_90
comment,pqkojt,4t7phi,,"Totally agree. My agency just removed degree requirements for our entire IT series. If we're serious about equity in federal hiring, skills-based approaches are essential. The biggest gap I see is in mid-career transitions. The system doesn't know what to do with career changers.",2023-08-01 09:23:33,3,FedEmployees,hiring_mgr
comment,hqcw76,k3x8mb,,"My team just hired someone through a skills assessment pilot and they're one of our best performers. I'm in a STEM field and even here, practical skills matter more than coursework. The real question is whether skills-based hiring survives the next administration change.",2023-08-01 19:50:01,12,govfire,data_nerd_gov_16
comment,349el8,pvpf8r,,"I'm in a STEM field and even here, practical skills matter more than coursework. I went through a RIF last year and ended up in a much better position. Don't give up. Thank you for sharing your experience. These conversations are how we build momentum for change. I think the apprenticeship model is the most promising pathway for non-degree candidates. The GS system was designed for a different era. Time to modernize.",2023-08-06 18:29:22,7,careerguidance,dc_commuter2238
comment,ckw5ng,9m4smz,,"The real barrier isn't policy — it's culture. Hiring managers need to believe in skills-based approaches. The skills-based approach works in theory, but HR classification specialists often push back. The real question is whether skills-based hiring survives the next administration change. Coming from healthcare into federal service, the skills translation was the hardest part. I'm a STAR and I've been a top performer for 22 years. Degrees don't determine competence.",2023-08-08 21:47:05,3,careerguidance,eeo_officer2955
comment,rrpzlk,cjpztc,,"The irony is that federal HR specialists themselves often don't have HR degrees. If we're serious about equity in federal hiring, skills-based approaches are essential. Coming from healthcare into federal service, the skills translation was the hardest part. I'd recommend looking into the recent OPM technical assistance materials on this.",2023-08-12 15:58:41,23,FedEmployees,eeo_officer_32
post,ckw5ng,ckw5ng,Skills-based hiring: real reform or just a buzzword?,Skills-based hiring is especially important for cybersecurity roles where the field evolves faster than any degree program can keep up. My agency piloted skills assessments last year and the quality of our hires improved dramatically.,2023-08-14 12:07:58,21,humanresources,think_tank_guy
comment,r64dpj,yk1b3d,,"I've worked in three different agencies and the hiring culture varies wildly between them. Coming from healthcare into federal service, the skills translation was the hardest part. Skills-based hiring + remote work could transform the geographic diversity of the federal workforce.",2023-08-16 18:25:53,45,jobs,new_fed5122
comment,hafeyu,yv3lxc,,The problem is that 'specialized experience' is often just code for 'has a degree.' Everyone talks about skills-based hiring but nobody talks about skills-based promotion. Thank you for sharing your experience. These conversations are how we build momentum for change.,2023-08-29 19:36:26,38,careerguidance,skills_first_27
comment,bcppvo,zb5gro,,I've been saying this for years — the federal hiring system is fundamentally broken. Skills-based hiring + remote work could transform the geographic diversity of the federal workforce. Structured interviews were a game-changer for our hiring panel. Much more equitable.,2023-08-31 11:53:20,12,feddiscussion,healthcare_admin_94
comment,bcppvo,zb5gro,,I've been saying this for years — the federal hiring system is fundamentally broken. Skills-based hiring + remote work could transform the geographic diversity of the federal workforce. Structured interviews were a game-changer for our hiring panel. Much more equitable.,2023-08-31 11:53:20,12,feddiscussion,healthcare_admin_94
comment,cc5o7u,x8hbbj,,"If you're going through a RIF, document everything and contact your union rep immediately. OPM needs to lead on this, not just issue guidance and hope agencies comply.",2023-09-01 19:23:33,1,jobs,hiring_mgr_29
comment,cc5o7u,gp51kf,,"I appreciate this post. Sometimes it feels like we're shouting into the void on these issues. As a hiring manager, I can confirm that we lose great candidates to the private sector constantly. If we're serious about equity in federal hiring, skills-based approaches are essential. My agency's HR office still thinks removing degree requirements will lower the quality of applicants.",2023-09-03 14:35:21,26,jobs,data_nerd_gov
comment,7s3kkv,iz1xev,,"My team just hired someone through a skills assessment pilot and they're one of our best performers. This is why I left federal service — the bureaucracy around hiring and promotion was suffocating. RIF procedures are governed by law, not just regulation — changing them requires Congressional action. I've worked in three different agencies and the hiring culture varies wildly between them. The problem is that 'specialized experience' is often just code for 'has a degree.'",2023-09-04 06:31:34,16,jobs,hr_specialist
comment,1jhuwb,r965r9,,Structured interviews were a game-changer for our hiring panel. Much more equitable. Has anyone actually seen the quality of hires improve after switching to skills-based assessments? Thank you for sharing your experience. These conversations are how we build momentum for change. I'm cautiously optimistic. The bipartisan STARS Act could be a real turning point.,2023-09-04 14:49:50,31,govfire,think_tank_guy_16
post,llo3rb,llo3rb,Is the Schedule A hiring authority being used for skills-based roles?,"I've hired dozens of people in my career and I can tell you that a degree tells me almost nothing about job performance. My team has been using structured interviews with skills-based rubrics and our retention rates have improved significantly. Federal hiring timelines destroy any goodwill that skills-based posting generates — by the time we make an offer, candidates have moved on.",2023-09-14 09:53:33,11,careerguidance,mil_spouse_fed_44
comment,dqnk20,kz3nwx,,The real barrier isn't policy — it's culture. Hiring managers need to believe in skills-based approaches. The data from agencies that have piloted this is really encouraging. This is a systemic issue. Individual agencies can only do so much without OPM reform. I'd recommend looking into the recent OPM technical assistance materials on this. This is exactly my experience too.,2023-09-14 15:14:22,2,feddiscussion,IT_fed7800
post,obk3g8,obk3g8,RIF layoffs are devastating our institutional knowledge,Skills-based hiring isn't just about removing degree requirements — it's about rethinking how we assess candidates entirely. The biggest misconception about skills-based hiring is that it lowers standards — it actually raises them by focusing on what matters. I know several STARs (Skilled Through Alternative Routes) who are better at their jobs than colleagues with advanced degrees.,2023-09-15 06:46:20,4,recruiting,career_changer_75
comment,r64dpj,2y0oy5,,This is such an important conversation. Federal hiring reform has bipartisan support for a reason. This is why I left federal service — the bureaucracy around hiring and promotion was suffocating.,2023-09-15 16:43:56,5,humanresources,star_advocate
post,nf74t6,nf74t6,Should federal internships require college enrollment?,"My agency piloted skills assessments last year and the quality of our hires improved dramatically. We lost three of our best analysts in the last RIF because they were the most junior, not the least skilled. I went through a RIF in 2024 and it was the most stressful experience of my career. The federal apprenticeship programs are a great model for skills-based entry, but they need to be scaled up. I mentored a young person who had amazing data analytics skills but couldn't get past the HR screen because of the degree filter.",2023-09-15 19:33:42,5,feddiscussion,think_tank_guy_37
comment,tpbn78,2c2bvp,,"I've been following the Opportunity@Work research closely and it's changing how I think about hiring. As a hiring manager, I can confirm that we lose great candidates to the private sector constantly.",2023-09-16 23:49:48,19,feddiscussion,training_dev
post,jd0ib6,jd0ib6,RIF survivors: how did you navigate the aftermath?,"The recent executive order on skills-based hiring is a step in the right direction, but implementation is going to be tough. Skills-based hiring isn't just about removing degree requirements — it's about rethinking how we assess candidates entirely. The federal apprenticeship programs are a great model for skills-based entry, but they need to be scaled up.",2023-09-25 02:36:33,19,careerguidance,non_profit_to_gov_84
post,jd0ib6,jd0ib6,RIF survivors: how did you navigate the aftermath?,"The recent executive order on skills-based hiring is a step in the right direction, but implementation is going to be tough. Skills-based hiring isn't just about removing degree requirements — it's about rethinking how we assess candidates entirely. The federal apprenticeship programs are a great model for skills-based entry, but they need to be scaled up.",2023-09-25 02:36:33,19,careerguidance,non_profit_to_gov_84
comment,t026rj,774rzg,,The real question is whether skills-based hiring survives the next administration change. Counterpoint: some positions genuinely require advanced education and we shouldn't throw the baby out with the bathwater.,2023-09-26 03:36:29,5,feddiscussion,data_nerd_gov
post,9kwv08,9kwv08,"The real problem with federal hiring isn't degrees, it's the timeline",Federal HR needs to stop treating degrees as a proxy for competence. Skills-based hiring is especially important for cybersecurity roles where the field evolves faster than any degree program can keep up. I've seen incredibly talented people get screened out because they don't have a bachelor's degree.,2023-09-27 14:38:20,25,careerguidance,eeo_officer
comment,rrpzlk,3rih83,,"This tracks with the research from Opportunity@Work and other organizations studying STARs. I've worked in three different agencies and the hiring culture varies wildly between them. I know several people who were RIF'd and are now making more money in the private sector. Silver lining, I guess. I went from enlisted military to GS-9 with no degree. The system can work, but it's harder than it should be.",2023-09-27 14:52:56,13,govfire,hr_manager_dc
comment,7s3kkv,jwk6z0,,"I know several people who were RIF'd and are now making more money in the private sector. Silver lining, I guess. The data from agencies that have piloted this is really encouraging. Thank you for sharing your experience. These conversations are how we build momentum for change.",2023-09-30 01:29:22,87,careerguidance,gs13_life3397
post,821uzv,821uzv,Just got my first federal offer — GS-7 with no degree!,"OPM needs to update the qualification standards — many of them reference degrees that aren't even relevant anymore. I've read the Opportunity@Work reports and the data is compelling — STARs perform just as well as workers with degrees. I went through a RIF in 2024 and it was the most stressful experience of my career. I came from the private sector where nobody cared about my degree, and now I'm struggling with USAJobs. The tech industry has been moving away from degree requirements for years — Google, Apple, IBM all dropped them.",2023-09-30 11:58:43,27,careerguidance,gov_analyst2262
comment,1sdw4s,gc8kix,,"Skills taxonomies like the ones NICE and OPM are developing could standardize this across agencies. As a hiring manager, I can confirm that we lose great candidates to the private sector constantly.",2023-10-01 06:01:01,6,jobs,gs13_life2115
post,89yjb1,89yjb1,Are competency-based interviews replacing KSAs?,"The DOGE-driven workforce reductions are going to set back federal hiring reform by years. Competency-based assessments would fix a lot of the problems with self-certification questionnaires. I'm a hiring manager and I wish I could post positions based purely on demonstrated skills, but OPM standards won't let me. I'm worried that the push for AI resume screening will just automate the existing biases in the system. I built my entire career through self-study and on-the-job learning, and I'm now a GS-13 making more than most of my degreed colleagues.",2023-10-02 11:14:28,2,careerguidance,resume_guru6561
comment,3z6bz8,pizx3h,,"I'm in a STEM field and even here, practical skills matter more than coursework. The irony is that federal HR specialists themselves often don't have HR degrees.",2023-10-04 10:10:20,28,deptHHS,dc_commuter_24
comment,m3p91i,k9ykip,,"Skills-based hiring + remote work could transform the geographic diversity of the federal workforce. The skills-based approach works in theory, but HR classification specialists often push back.",2023-10-04 14:28:46,21,feddiscussion,think_tank_guy_85
comment,cqmrun,0r35ik,,This is exactly my experience too. Totally agree. My agency just removed degree requirements for our entire IT series. I've been saying this for years — the federal hiring system is fundamentally broken.,2023-10-06 04:34:21,9,FedEmployees,contracting_pro9181
comment,lx6dut,3m25a5,,"This is such an important conversation. Federal hiring reform has bipartisan support for a reason. Has anyone actually seen the quality of hires improve after switching to skills-based assessments? The skills-based approach works in theory, but HR classification specialists often push back. The real barrier isn't policy — it's culture. Hiring managers need to believe in skills-based approaches. Coming from healthcare into federal service, the skills translation was the hardest part.",2023-10-07 01:55:06,26,recruiting,talent_scout_62
post,1jhuwb,1jhuwb,What certifications actually matter for federal jobs?,"The federal government needs to invest in upskilling current employees, not just reforming external hiring. The GS classification system desperately needs to incorporate skills-based elements. I transitioned from a trade job to federal IT and the hardest part was translating my experience into federal resume language. I went through a RIF in 2024 and it was the most stressful experience of my career.",2023-10-08 15:30:06,9,careerguidance,think_tank_guy5573
comment,8w5rtw,p7bd4w,,"I've been saying this for years — the federal hiring system is fundamentally broken. I know several people who were RIF'd and are now making more money in the private sector. Silver lining, I guess. I went through a RIF last year and ended up in a much better position. Don't give up.",2023-10-09 13:53:23,18,careerguidance,fed_employee2344
post,6f7low,6f7low,My agency is using AI to screen resumes now — anyone else?,"The data on skills-based hiring outcomes is really promising — agencies that adopt it see better diversity and performance metrics. Federal employees who got RIF'd should get priority consideration through a skills-matching program, not just bumping rights. HHS is going through massive changes right now and it's not clear how hiring reform fits into the picture. RIF procedures need to factor in critical skills retention, not just tenure and veterans preference.",2023-10-10 01:44:48,7,humanresources,hr_manager_dc_77
comment,td44k1,b9oi0d,,Everyone talks about skills-based hiring but nobody talks about skills-based promotion. The DOGE cuts are making this even more urgent — we need to retain the skills we have left.,2023-10-26 11:39:42,10,deptHHS,IT_fed4945
comment,xtfdc7,985i0h,,My agency's HR office still thinks removing degree requirements will lower the quality of applicants. Everyone talks about skills-based hiring but nobody talks about skills-based promotion. Skills-based hiring + remote work could transform the geographic diversity of the federal workforce.,2023-10-29 02:33:38,44,jobs,star_advocate7372
post,pcn9t8,pcn9t8,Is skills-based hiring actually happening in the federal government?,"I've read the Opportunity@Work reports and the data is compelling — STARs perform just as well as workers with degrees. Federal employees who got RIF'd should get priority consideration through a skills-matching program, not just bumping rights.",2023-11-07 09:13:24,9,govfire,think_tank_guy4315
comment,zlaoi4,hn6bed,,"Skills-based hiring is meaningless if the pay scale doesn't reflect market value for those skills. RIF procedures are governed by law, not just regulation — changing them requires Congressional action. I'd recommend looking into the recent OPM technical assistance materials on this.",2023-11-09 09:34:09,4,jobs,skills_first
post,gl58kx,gl58kx,Federal HR specialists: what's your take on removing degree requirements?,Our agency just posted a GS-12 position that explicitly says 'degree OR equivalent experience.' The federal government loses so many good candidates to the private sector because the hiring process takes 6-9 months. Federal HR needs to stop treating degrees as a proxy for competence. Competency-based assessments would fix a lot of the problems with self-certification questionnaires.,2023-11-09 21:56:35,5,feddiscussion,mil_spouse_fed_74
comment,21o0z5,icautj,,"RIF procedures are governed by law, not just regulation — changing them requires Congressional action. Totally agree. My agency just removed degree requirements for our entire IT series. I know several people who were RIF'd and are now making more money in the private sector. Silver lining, I guess. I appreciate this post. Sometimes it feels like we're shouting into the void on these issues. Coming from healthcare into federal service, the skills translation was the hardest part.",2023-11-12 13:57:01,29,deptHHS,tech_to_fed9628
comment,4dyt9m,ztdl25,,The biggest gap I see is in mid-career transitions. The system doesn't know what to do with career changers. I think the apprenticeship model is the most promising pathway for non-degree candidates.,2023-11-18 10:37:11,12,careerguidance,resume_guru
comment,3jonou,iifrch,,"I'm in a STEM field and even here, practical skills matter more than coursework. I'm cautiously optimistic. The bipartisan STARS Act could be a real turning point. The DOGE cuts are making this even more urgent — we need to retain the skills we have left. If you're going through a RIF, document everything and contact your union rep immediately. If we're serious about equity in federal hiring, skills-based approaches are essential.",2023-11-23 14:51:51,7,govfire,usajobs_veteran1140
comment,7l8v1z,rc85eh,,"The biggest gap I see is in mid-career transitions. The system doesn't know what to do with career changers. This is a systemic issue. Individual agencies can only do so much without OPM reform. RIF procedures are governed by law, not just regulation — changing them requires Congressional action. This is such an important conversation. Federal hiring reform has bipartisan support for a reason. The GS system was designed for a different era. Time to modernize.",2023-11-24 10:04:40,26,feddiscussion,vet_preference4044
comment,hqcw76,cbw6at,,The federal government employs over 2 million people — even small improvements in hiring practices have huge impacts. Thank you for sharing your experience. These conversations are how we build momentum for change.,2023-11-24 19:25:25,45,feddiscussion,tech_to_fed_27
comment,0w10lb,8d2vfh,,"I'm in a STEM field and even here, practical skills matter more than coursework. This is why I left federal service — the bureaucracy around hiring and promotion was suffocating. The GS system was designed for a different era. Time to modernize. I've worked in three different agencies and the hiring culture varies wildly between them. Skills-based hiring is meaningless if the pay scale doesn't reflect market value for those skills.",2023-11-30 02:58:21,71,govfire,policy_wonk4146
comment,89yjb1,l9700l,,"Skills taxonomies like the ones NICE and OPM are developing could standardize this across agencies. I'm a STAR and I've been a top performer for 23 years. Degrees don't determine competence. I know several people who were RIF'd and are now making more money in the private sector. Silver lining, I guess.",2023-12-01 22:03:20,4,govfire,hill_staffer
comment,v1xg1r,x9djoy,,Everyone talks about skills-based hiring but nobody talks about skills-based promotion. I'd recommend looking into the recent OPM technical assistance materials on this. My agency's HR office still thinks removing degree requirements will lower the quality of applicants. This is exactly my experience too. I've worked in three different agencies and the hiring culture varies wildly between them.,2023-12-08 10:38:40,4,jobs,hr_specialist
comment,cqmrun,917rmp,,I've been following the Opportunity@Work research closely and it's changing how I think about hiring. The DOGE cuts are making this even more urgent — we need to retain the skills we have left. My team just hired someone through a skills assessment pilot and they're one of our best performers. The federal government employs over 2 million people — even small improvements in hiring practices have huge impacts.,2023-12-11 19:11:04,7,jobs,fed_employee
post,jepecq,jepecq,Veterans preference + skills-based hiring = the future?,Our union is actually supportive of skills-based hiring as long as it doesn't undermine seniority protections. The data on skills-based hiring outcomes is really promising — agencies that adopt it see better diversity and performance metrics.,2023-12-13 13:03:46,8,FedEmployees,gov_analyst_62
post,h9p89f,h9p89f,Career change at 40 — can I get into federal service?,"I came from the private sector where nobody cared about my degree, and now I'm struggling with USAJobs. My agency piloted skills assessments last year and the quality of our hires improved dramatically.",2023-12-14 04:33:14,6,feddiscussion,class_act_rep
comment,qimqod,7opidl,,"Structured interviews were a game-changer for our hiring panel. Much more equitable. Coming from healthcare into federal service, the skills translation was the hardest part.",2023-12-14 16:24:23,7,deptHHS,dc_commuter4562
comment,nvuprt,vlu8wp,,"OPM needs to lead on this, not just issue guidance and hope agencies comply. Skills taxonomies like the ones NICE and OPM are developing could standardize this across agencies. Great post. I'd add that the timeline issue is just as important as the degree requirements.",2023-12-26 17:45:03,22,deptHHS,agency_hopper5431
post,t026rj,t026rj,Just finished a federal apprenticeship — here's my experience,"I've seen the same position classified at GS-9 in one agency and GS-13 in another — the system is broken. If the private sector can move to skills-based hiring, there's no reason the federal government can't.",2023-12-28 01:34:03,13,govfire,training_dev_69
