type,thread_id,id,title,body,created_utc,score,subreddit,author
post,igqpki,igqpki,Skills-based hiring: real reform or just a buzzword?,"My experience going through the Pathways program showed me how much the federal government values credentials over capability. Skills-based hiring isn't just about removing degree requirements — it's about rethinking how we assess candidates entirely. The recent executive order on skills-based hiring is a step in the right direction, but implementation is going to be tough. The federal government needs to invest in upskilling current employees, not just reforming external hiring. Federal employees who got RIF'd should get priority consideration through a skills-matching program, not just bumping rights.",2022-09-13 18:07:00,8,jobs,federal_worker_50
post,izzqy7,izzqy7,What certifications actually matter for federal jobs?,"I'm worried that the push for AI resume screening will just automate the existing biases in the system. The federal government loses so many good candidates to the private sector because the hiring process takes 6-9 months. Federal employees who got RIF'd should get priority consideration through a skills-matching program, not just bumping rights.",2022-09-15 18:02:59,4,humanresources,eeo_officer_96
comment,8cgn0t,mxlvz4,,Skills taxonomies like the ones NICE and OPM are developing could standardize this across agencies. I think the apprenticeship model is the most promising pathway for non-degree candidates. I'm cautiously optimistic. The bipartisan STARS Act could be a real turning point. The problem is that 'specialized experience' is often just code for 'has a degree.' This is such an important conversation. Federal hiring reform has bipartisan support for a reason.,2022-09-16 10:27:53,20,govfire,program_analyst
comment,sujt9t,9hzbgt,,Thank you for sharing your experience. These conversations are how we build momentum for change. Skills-based hiring + remote work could transform the geographic diversity of the federal workforce. Counterpoint: some positions genuinely require advanced education and we shouldn't throw the baby out with the bathwater. Federal HR needs more training on how to evaluate non-traditional credentials.,2022-09-17 07:47:33,41,humanresources,fed_employee744
comment,t026rj,0khfsu,,"The problem is that 'specialized experience' is often just code for 'has a degree.' I know several people who were RIF'd and are now making more money in the private sector. Silver lining, I guess.",2022-09-19 01:27:51,41,careerguidance,talent_scout
post,8sryo4,8sryo4,Just finished a federal apprenticeship — here's my experience,"I've seen incredibly talented people get screened out because they don't have a bachelor's degree. The tech industry has been moving away from degree requirements for years — Google, Apple, IBM all dropped them. Our agency just posted a GS-12 position that explicitly says 'degree OR equivalent experience.'",2022-09-19 07:17:06,24,careerguidance,hr_specialist8115
post,7c9hx3,7c9hx3,My agency just eliminated degree requirements for GS-9 through GS-12,"The federal government loses so many good candidates to the private sector because the hiring process takes 6-9 months. I came from the private sector where nobody cared about my degree, and now I'm struggling with USAJobs. The biggest misconception about skills-based hiring is that it lowers standards — it actually raises them by focusing on what matters. The recent executive order on skills-based hiring is a step in the right direction, but implementation is going to be tough.",2022-09-26 10:43:11,14,recruiting,star_advocate_24
post,v7mqxs,v7mqxs,Switching from private sector to federal — is USAJobs still a black hole?,"The DOGE-driven workforce reductions are going to set back federal hiring reform by years. I've been coaching people through the federal hiring process for 22 years and the biggest barrier is always the degree requirement. The federal government loses so many good candidates to the private sector because the hiring process takes 6-9 months. If the private sector can move to skills-based hiring, there's no reason the federal government can't. The RIF process is brutal and seems to penalize newer employees regardless of their actual skills or contributions.",2022-09-30 14:55:28,29,jobs,retired_ses
comment,jssuuq,geuidj,,"Skills-based hiring + remote work could transform the geographic diversity of the federal workforce. I'm in a STEM field and even here, practical skills matter more than coursework. I went from enlisted military to GS-5 with no degree. The system can work, but it's harder than it should be.",2022-10-02 08:23:47,5,jobs,former_teacher8470
comment,bps3y7,w7jp61,,"I used to work in private sector HR and the contrast with federal hiring is staggering. This is such an important conversation. Federal hiring reform has bipartisan support for a reason. The federal workforce planning data is clear: we need new approaches to attract and retain talent. The skills-based approach works in theory, but HR classification specialists often push back.",2022-10-04 09:41:31,8,careerguidance,dc_commuter3287
comment,gl58kx,l6tbb6,,"OPM needs to lead on this, not just issue guidance and hope agencies comply. I went from enlisted military to GS-14 with no degree. The system can work, but it's harder than it should be.",2022-10-06 00:58:10,82,careerguidance,training_dev_46
comment,821uzv,pwo6cm,,"My team just hired someone through a skills assessment pilot and they're one of our best performers. Coming from healthcare into federal service, the skills translation was the hardest part. This tracks with the research from Opportunity@Work and other organizations studying STARs. The biggest gap I see is in mid-career transitions. The system doesn't know what to do with career changers.",2022-10-13 15:46:27,19,FedEmployees,fed_employee3844
post,lx6dut,lx6dut,I'm a STAR who made it to SES — proof the system can work,"Competency-based assessments would fix a lot of the problems with self-certification questionnaires. The federal apprenticeship programs are a great model for skills-based entry, but they need to be scaled up.",2022-10-17 10:12:03,13,humanresources,policy_wonk4888
comment,3t60rj,dpwvbz,,"I'm cautiously optimistic. The bipartisan STARS Act could be a real turning point. I went from enlisted military to GS-13 with no degree. The system can work, but it's harder than it should be.",2022-10-17 19:16:51,5,deptHHS,public_servant3175
comment,ykl1cq,ajw253,,"Thank you for sharing your experience. These conversations are how we build momentum for change. Everyone talks about skills-based hiring but nobody talks about skills-based promotion. If you're going through a RIF, document everything and contact your union rep immediately. I've worked in three different agencies and the hiring culture varies wildly between them.",2022-10-18 10:59:31,9,govfire,tech_to_fed
comment,iyzcot,1hm38k,,"If we're serious about equity in federal hiring, skills-based approaches are essential. OPM needs to lead on this, not just issue guidance and hope agencies comply. Great post. I'd add that the timeline issue is just as important as the degree requirements. This is such an important conversation. Federal hiring reform has bipartisan support for a reason.",2022-10-19 08:07:29,16,feddiscussion,vet_preference
comment,zlaoi4,0gkejz,,"I'd recommend looking into the recent OPM technical assistance materials on this. RIF procedures are governed by law, not just regulation — changing them requires Congressional action. The biggest gap I see is in mid-career transitions. The system doesn't know what to do with career changers. OPM needs to lead on this, not just issue guidance and hope agencies comply. If we're serious about equity in federal hiring, skills-based approaches are essential.",2022-10-26 12:53:32,59,govfire,retired_ses
comment,ve92mp,jsxfoh,,"Counterpoint: some positions genuinely require advanced education and we shouldn't throw the baby out with the bathwater. I know several people who were RIF'd and are now making more money in the private sector. Silver lining, I guess. I've been saying this for years — the federal hiring system is fundamentally broken.",2022-10-29 02:57:27,9,jobs,hiring_mgr_36
comment,8sryo4,h6a50n,,"The data from agencies that have piloted this is really encouraging. Structured interviews were a game-changer for our hiring panel. Much more equitable. I've worked in three different agencies and the hiring culture varies wildly between them. Federal HR needs more training on how to evaluate non-traditional credentials. I went from enlisted military to GS-9 with no degree. The system can work, but it's harder than it should be.",2022-10-29 17:21:07,5,jobs,telework_fan5711
post,xlm5q2,xlm5q2,I'm a STAR who made it to SES — proof the system can work,"Our agency created a skills inventory for all employees last year and discovered incredible untapped talent. We lost three of our best analysts in the last RIF because they were the most junior, not the least skilled. The Opportunity@Work research shows that over 70 million workers in the US are STARs — the federal government should tap into that talent pool. The problem isn't just degrees — it's that federal job announcements are written in incomprehensible bureaucratic language. The federal apprenticeship programs are a great model for skills-based entry, but they need to be scaled up.",2022-11-01 18:33:35,8,recruiting,public_servant
comment,821uzv,74zq50,,"The data from agencies that have piloted this is really encouraging. I've been following the Opportunity@Work research closely and it's changing how I think about hiring. Coming from healthcare into federal service, the skills translation was the hardest part. I've worked in three different agencies and the hiring culture varies wildly between them. Federal HR needs more training on how to evaluate non-traditional credentials.",2022-11-06 21:18:39,10,govfire,eeo_officer_63
comment,0s9bp4,533zsm,,"Skills taxonomies like the ones NICE and OPM are developing could standardize this across agencies. If we're serious about equity in federal hiring, skills-based approaches are essential. I've been saying this for years — the federal hiring system is fundamentally broken. Thank you for sharing your experience. These conversations are how we build momentum for change.",2022-11-07 19:20:54,9,humanresources,data_nerd_gov
comment,1a07h2,1l0vdp,,"I've worked in three different agencies and the hiring culture varies wildly between them. I know several people who were RIF'd and are now making more money in the private sector. Silver lining, I guess. Thank you for sharing your experience. These conversations are how we build momentum for change. My agency's HR office still thinks removing degree requirements will lower the quality of applicants. Federal HR needs more training on how to evaluate non-traditional credentials.",2022-11-08 19:38:11,15,FedEmployees,agency_hopper
comment,xtfdc7,6jzv9n,,"My team just hired someone through a skills assessment pilot and they're one of our best performers. I'm cautiously optimistic. The bipartisan STARS Act could be a real turning point. OPM needs to lead on this, not just issue guidance and hope agencies comply. I know several people who were RIF'd and are now making more money in the private sector. Silver lining, I guess. If we're serious about equity in federal hiring, skills-based approaches are essential.",2022-11-10 10:06:24,19,careerguidance,dc_commuter_69
comment,ippsfn,2zi5sg,,"The skills-based approach works in theory, but HR classification specialists often push back. I know several people who were RIF'd and are now making more money in the private sector. Silver lining, I guess.",2022-11-14 05:52:26,65,govfire,career_changer9709
comment,0w10lb,imoe0s,,The data from agencies that have piloted this is really encouraging. The federal government employs over 2 million people — even small improvements in hiring practices have huge impacts. I'm cautiously optimistic. The bipartisan STARS Act could be a real turning point.,2022-11-18 04:28:11,83,govfire,class_act_rep
comment,zlaoi4,w6tm2o,,My agency's HR office still thinks removing degree requirements will lower the quality of applicants. I think the apprenticeship model is the most promising pathway for non-degree candidates.,2022-11-20 12:35:15,6,recruiting,IT_fed_9
comment,1jhuwb,yahulw,,The real question is whether skills-based hiring survives the next administration change. Skills-based hiring + remote work could transform the geographic diversity of the federal workforce. I used to work in private sector HR and the contrast with federal hiring is staggering. The federal government employs over 2 million people — even small improvements in hiring practices have huge impacts.,2022-11-24 01:13:11,3,jobs,cyber_fed_47
comment,u0dk0g,25mdf7,,"I know several people who were RIF'd and are now making more money in the private sector. Silver lining, I guess. Thank you for sharing your experience. These conversations are how we build momentum for change. The data from agencies that have piloted this is really encouraging.",2022-11-24 13:18:33,9,recruiting,gov_analyst
comment,1a07h2,z52ohk,,"If you're going through a RIF, document everything and contact your union rep immediately. The DOGE cuts are making this even more urgent — we need to retain the skills we have left.",2022-11-29 00:36:01,15,feddiscussion,tech_to_fed5115
post,zlm72j,zlm72j,Anyone else see the new executive order on federal hiring reform?,"Skills-based hiring would particularly benefit veterans who have incredible real-world experience but may not have traditional credentials. My team has been using structured interviews with skills-based rubrics and our retention rates have improved significantly. Federal hiring timelines destroy any goodwill that skills-based posting generates — by the time we make an offer, candidates have moved on. OPM needs to update the qualification standards — many of them reference degrees that aren't even relevant anymore. I've hired dozens of people in my career and I can tell you that a degree tells me almost nothing about job performance.",2022-11-29 10:00:23,7,deptHHS,program_analyst9208
post,lxxezd,lxxezd,DOGE workforce reductions are targeting the wrong people,"The federal government needs to invest in upskilling current employees, not just reforming external hiring. If the private sector can move to skills-based hiring, there's no reason the federal government can't. I know several STARs (Skilled Through Alternative Routes) who are better at their jobs than colleagues with advanced degrees. Skills-based hiring is especially important for cybersecurity roles where the field evolves faster than any degree program can keep up. The problem with federal hiring reform is that every administration starts over instead of building on what worked before.",2022-11-29 17:40:52,25,recruiting,former_teacher
post,qot8hl,qot8hl,Federal hiring managers: do you actually care about degrees?,I've seen incredibly talented people get screened out because they don't have a bachelor's degree. The RIF process is brutal and seems to penalize newer employees regardless of their actual skills or contributions.,2022-12-01 00:33:21,25,recruiting,budget_hawk_12
comment,6qicat,yce4qg,,Has anyone actually seen the quality of hires improve after switching to skills-based assessments? This tracks with the research from Opportunity@Work and other organizations studying STARs. The GS system was designed for a different era. Time to modernize. This is such an important conversation. Federal hiring reform has bipartisan support for a reason.,2022-12-03 05:33:54,13,careerguidance,think_tank_guy237
comment,92xf8e,a3y5t3,,"The biggest gap I see is in mid-career transitions. The system doesn't know what to do with career changers. Has anyone actually seen the quality of hires improve after switching to skills-based assessments? I'm in a STEM field and even here, practical skills matter more than coursework. This is such an important conversation. Federal hiring reform has bipartisan support for a reason.",2022-12-07 01:25:21,11,jobs,workforce_dev9163
comment,2m5zja,5ixva1,,"As a hiring manager, I can confirm that we lose great candidates to the private sector constantly. I think the apprenticeship model is the most promising pathway for non-degree candidates. My agency's HR office still thinks removing degree requirements will lower the quality of applicants. Great post. I'd add that the timeline issue is just as important as the degree requirements. My team just hired someone through a skills assessment pilot and they're one of our best performers.",2022-12-11 23:57:08,4,jobs,resume_guru
comment,bps3y7,64w3u1,,,2022-12-13 21:28:30,5,humanresources,fed_employee8210
comment,v3i12v,zyt91q,,"I went through a RIF last year and ended up in a much better position. Don't give up. If we're serious about equity in federal hiring, skills-based approaches are essential. Skills taxonomies like the ones NICE and OPM are developing could standardize this across agencies.",2022-12-14 15:39:43,30,govfire,training_dev_34
comment,v3i12v,zyt91q,,"I went through a RIF last year and ended up in a much better position. Don't give up. If we're serious about equity in federal hiring, skills-based approaches are essential. Skills taxonomies like the ones NICE and OPM are developing could standardize this across agencies.",2022-12-14 15:39:43,30,govfire,training_dev_34
post,hlxslg,hlxslg,Has anyone used the new pathways program without a degree?,"Federal employees who got RIF'd should get priority consideration through a skills-matching program, not just bumping rights. My team has been using structured interviews with skills-based rubrics and our retention rates have improved significantly. I've read the Opportunity@Work reports and the data is compelling — STARs perform just as well as workers with degrees. Federal hiring timelines destroy any goodwill that skills-based posting generates — by the time we make an offer, candidates have moved on.",2022-12-16 07:39:02,16,humanresources,resume_guru3396
comment,ftu2gc,7velfv,,The irony is that federal HR specialists themselves often don't have HR degrees. This is why I left federal service — the bureaucracy around hiring and promotion was suffocating. This is a systemic issue. Individual agencies can only do so much without OPM reform. Totally agree. My agency just removed degree requirements for our entire IT series. My agency's HR office still thinks removing degree requirements will lower the quality of applicants.,2022-12-17 19:34:19,21,feddiscussion,telework_fan4853
comment,cqmrun,e1zubl,,"I went from enlisted military to GS-12 with no degree. The system can work, but it's harder than it should be. This tracks with the research from Opportunity@Work and other organizations studying STARs.",2022-12-17 21:10:18,7,jobs,resume_guru
comment,fy6452,epppra,,Federal hiring reform needs champions at the SES level to actually move the needle. Federal HR needs more training on how to evaluate non-traditional credentials. This is exactly my experience too.,2022-12-18 11:47:49,34,recruiting,usajobs_veteran_17
comment,vxdp5g,07g2re,,Federal hiring reform needs champions at the SES level to actually move the needle. This is why I left federal service — the bureaucracy around hiring and promotion was suffocating. Everyone talks about skills-based hiring but nobody talks about skills-based promotion.,2022-12-24 09:22:44,12,feddiscussion,data_nerd_gov
comment,5uofwb,6qihpn,,Federal HR needs more training on how to evaluate non-traditional credentials. I used to work in private sector HR and the contrast with federal hiring is staggering. Skills-based hiring + remote work could transform the geographic diversity of the federal workforce.,2022-12-24 13:38:31,6,FedEmployees,think_tank_guy_66
comment,wovcxe,x57u0y,,The irony is that federal HR specialists themselves often don't have HR degrees. The GS system was designed for a different era. Time to modernize. Skills-based hiring + remote work could transform the geographic diversity of the federal workforce. Same situation at my agency. We lost our best people in the RIF while keeping underperformers with more seniority.,2022-12-26 23:15:53,2,jobs,cyber_fed
post,xaji0y,xaji0y,Has anyone used the new pathways program without a degree?,"I'm a hiring manager and I wish I could post positions based purely on demonstrated skills, but OPM standards won't let me. I'm worried that the push for AI resume screening will just automate the existing biases in the system.",2022-12-28 10:13:36,19,FedEmployees,management_analyst_26
comment,bo119x,3mg1za,,Federal HR needs more training on how to evaluate non-traditional credentials. I'd recommend looking into the recent OPM technical assistance materials on this. This is why I left federal service — the bureaucracy around hiring and promotion was suffocating. This is exactly my experience too. Has anyone actually seen the quality of hires improve after switching to skills-based assessments?,2022-12-30 21:46:08,4,careerguidance,cyber_fed_5
post,c50h2c,c50h2c,What certifications actually matter for federal jobs?,I think we need to separate the discussion about RIFs from the discussion about hiring reform — they're related but different problems. The data on skills-based hiring outcomes is really promising — agencies that adopt it see better diversity and performance metrics.,2023-01-03 00:44:28,7,feddiscussion,budget_hawk
comment,zhwy9h,56onxd,,The federal government employs over 2 million people — even small improvements in hiring practices have huge impacts. Totally agree. My agency just removed degree requirements for our entire IT series. I'm cautiously optimistic. The bipartisan STARS Act could be a real turning point.,2023-01-05 20:08:54,25,feddiscussion,data_nerd_gov9573
comment,ouuyla,2sjxl6,,I've been following the Opportunity@Work research closely and it's changing how I think about hiring. The federal government employs over 2 million people — even small improvements in hiring practices have huge impacts. This is exactly my experience too. The data from agencies that have piloted this is really encouraging. Great post. I'd add that the timeline issue is just as important as the degree requirements.,2023-01-11 16:07:02,19,jobs,skills_first
post,1a07h2,1a07h2,The bipartisan push for skills-based hiring — will it stick?,"The federal apprenticeship programs are a great model for skills-based entry, but they need to be scaled up. I've read the Opportunity@Work reports and the data is compelling — STARs perform just as well as workers with degrees.",2023-01-11 23:12:11,111,humanresources,budget_hawk_92
comment,lxxezd,arr3vr,,"Everyone talks about skills-based hiring but nobody talks about skills-based promotion. This is a systemic issue. Individual agencies can only do so much without OPM reform. RIF procedures are governed by law, not just regulation — changing them requires Congressional action.",2023-01-16 03:34:05,19,humanresources,training_dev
comment,lxxezd,7zcgdc,,"Skills-based hiring + remote work could transform the geographic diversity of the federal workforce. As a hiring manager, I can confirm that we lose great candidates to the private sector constantly. I've been saying this for years — the federal hiring system is fundamentally broken. The federal workforce planning data is clear: we need new approaches to attract and retain talent. Structured interviews were a game-changer for our hiring panel. Much more equitable.",2023-01-20 07:36:38,390,humanresources,hill_staffer
post,e4261b,e4261b,What certifications actually matter for federal jobs?,Our agency just posted a GS-14 position that explicitly says 'degree OR equivalent experience.' The federal government loses so many good candidates to the private sector because the hiring process takes 6-9 months. The RIF process is brutal and seems to penalize newer employees regardless of their actual skills or contributions. Our union is actually supportive of skills-based hiring as long as it doesn't undermine seniority protections. The biggest misconception about skills-based hiring is that it lowers standards — it actually raises them by focusing on what matters.,2023-01-24 23:11:20,87,feddiscussion,cyber_fed
comment,jepecq,v9e40k,,"Thank you for sharing your experience. These conversations are how we build momentum for change. Coming from healthcare into federal service, the skills translation was the hardest part. Structured interviews were a game-changer for our hiring panel. Much more equitable. Counterpoint: some positions genuinely require advanced education and we shouldn't throw the baby out with the bathwater.",2023-01-25 10:23:43,21,careerguidance,former_teacher
comment,ykl1cq,g2y8rg,,"As a hiring manager, I can confirm that we lose great candidates to the private sector constantly. Coming from healthcare into federal service, the skills translation was the hardest part.",2023-01-26 12:11:31,7,recruiting,training_dev
comment,m3p91i,q8va8x,,My team just hired someone through a skills assessment pilot and they're one of our best performers. Federal hiring reform needs champions at the SES level to actually move the needle. I'm cautiously optimistic. The bipartisan STARS Act could be a real turning point. The problem is that 'specialized experience' is often just code for 'has a degree.' Same situation at my agency. We lost our best people in the RIF while keeping underperformers with more seniority.,2023-02-01 09:11:59,34,govfire,agency_hopper
