type,thread_id,id,title,body,created_utc,score,subreddit,author
comment,6f7low,571vxn,,"Coming from healthcare into federal service, the skills translation was the hardest part. Skills-based hiring + remote work could transform the geographic diversity of the federal workforce. I'm in a STEM field and even here, practical skills matter more than coursework. Has anyone actually seen the quality of hires improve after switching to skills-based assessments? I used to work in private sector HR and the contrast with federal hiring is staggering.",2024-06-08 20:59:10,37,recruiting,fed_employee6229
comment,krcppr,x70fql,,"The skills-based approach works in theory, but HR classification specialists often push back. As a hiring manager, I can confirm that we lose great candidates to the private sector constantly.",2024-06-12 04:08:52,4,deptHHS,telework_fan_53
post,lpq2wg,lpq2wg,Federal telework policies are driving away skilled workers,,2024-06-15 21:05:24,4,feddiscussion,program_analyst_24
comment,kef828,x44paa,,"Counterpoint: some positions genuinely require advanced education and we shouldn't throw the baby out with the bathwater. RIF procedures are governed by law, not just regulation — changing them requires Congressional action.",2024-06-19 07:56:51,3,feddiscussion,union_steward_79
comment,okzixz,uqaaj8,,"Totally agree. My agency just removed degree requirements for our entire IT series. Coming from healthcare into federal service, the skills translation was the hardest part. This is a systemic issue. Individual agencies can only do so much without OPM reform. This tracks with the research from Opportunity@Work and other organizations studying STARs. The data from agencies that have piloted this is really encouraging.",2024-06-21 15:42:07,26,careerguidance,hr_specialist4225
comment,qimqod,022wgn,,"I know several people who were RIF'd and are now making more money in the private sector. Silver lining, I guess. My agency's HR office still thinks removing degree requirements will lower the quality of applicants. Skills taxonomies like the ones NICE and OPM are developing could standardize this across agencies. The real question is whether skills-based hiring survives the next administration change.",2024-06-21 20:12:36,13,jobs,class_act_rep
comment,9kwv08,9kkh4a,,Skills-based hiring + remote work could transform the geographic diversity of the federal workforce. The real barrier isn't policy — it's culture. Hiring managers need to believe in skills-based approaches. I'm cautiously optimistic. The bipartisan STARS Act could be a real turning point. I'm a STAR and I've been a top performer for 10 years. Degrees don't determine competence.,2024-06-23 08:20:16,32,deptHHS,public_servant
comment,9kwv08,9kkh4a,,Skills-based hiring + remote work could transform the geographic diversity of the federal workforce. The real barrier isn't policy — it's culture. Hiring managers need to believe in skills-based approaches. I'm cautiously optimistic. The bipartisan STARS Act could be a real turning point. I'm a STAR and I've been a top performer for 10 years. Degrees don't determine competence.,2024-06-23 08:20:16,32,deptHHS,public_servant
comment,hqcw76,susmes,,"If you're going through a RIF, document everything and contact your union rep immediately. I'm cautiously optimistic. The bipartisan STARS Act could be a real turning point. I used to work in private sector HR and the contrast with federal hiring is staggering. If we're serious about equity in federal hiring, skills-based approaches are essential.",2024-06-30 14:28:41,16,FedEmployees,non_profit_to_gov
comment,od9r7a,zj3swe,,The federal government employs over 2 million people — even small improvements in hiring practices have huge impacts. Federal HR needs more training on how to evaluate non-traditional credentials.,2024-06-30 16:28:53,6,recruiting,IT_fed4237
comment,koixnt,tyold6,,I'm a STAR and I've been a top performer for 5 years. Degrees don't determine competence. Has anyone actually seen the quality of hires improve after switching to skills-based assessments? Skills-based hiring is meaningless if the pay scale doesn't reflect market value for those skills. This is exactly my experience too.,2024-07-03 17:03:48,4,careerguidance,hiring_mgr5716
post,qzpniq,qzpniq,Degree inflation in federal job postings is getting worse,I've been coaching people through the federal hiring process for 3 years and the biggest barrier is always the degree requirement. I mentored a young person who had amazing data analytics skills but couldn't get past the HR screen because of the degree filter. Our agency created a skills inventory for all employees last year and discovered incredible untapped talent. The federal government loses so many good candidates to the private sector because the hiring process takes 6-9 months.,2024-07-11 15:50:34,15,FedEmployees,hill_staffer
post,m3p91i,m3p91i,Should federal internships require college enrollment?,"RIF procedures need to factor in critical skills retention, not just tenure and veterans preference. Certification programs like CompTIA, PMP, and SHRM should carry more weight in federal qualification standards. I built my entire career through self-study and on-the-job learning, and I'm now a GS-13 making more than most of my degreed colleagues. I'm worried that the push for AI resume screening will just automate the existing biases in the system.",2024-07-16 04:28:02,43,govfire,data_nerd_gov_91
post,zlaoi4,zlaoi4,Anyone else see the new executive order on federal hiring reform?,,2024-07-20 02:24:59,14,govfire,dc_commuter_36
post,yn2jcp,yn2jcp,New OPM memo on skills assessments — this is big,"Federal employees who got RIF'd should get priority consideration through a skills-matching program, not just bumping rights. I've hired dozens of people in my career and I can tell you that a degree tells me almost nothing about job performance. We lost three of our best analysts in the last RIF because they were the most junior, not the least skilled.",2024-07-25 03:21:45,49,jobs,gs13_life_89
comment,kef828,w4emm9,,This is such an important conversation. Federal hiring reform has bipartisan support for a reason. My agency's HR office still thinks removing degree requirements will lower the quality of applicants.,2024-07-30 13:26:51,7,FedEmployees,program_analyst8486
comment,rxyj38,paytxw,,"If we're serious about equity in federal hiring, skills-based approaches are essential. The skills-based approach works in theory, but HR classification specialists often push back.",2024-07-31 06:24:49,18,feddiscussion,resume_guru_98
comment,zlm72j,ae58hu,,The federal workforce planning data is clear: we need new approaches to attract and retain talent. This tracks with the research from Opportunity@Work and other organizations studying STARs. Counterpoint: some positions genuinely require advanced education and we shouldn't throw the baby out with the bathwater.,2024-08-11 07:02:37,19,humanresources,think_tank_guy
comment,1jhuwb,m6j8y6,,I've worked in three different agencies and the hiring culture varies wildly between them. I'd recommend looking into the recent OPM technical assistance materials on this. The federal government employs over 2 million people — even small improvements in hiring practices have huge impacts. I used to work in private sector HR and the contrast with federal hiring is staggering. Same situation at my agency. We lost our best people in the RIF while keeping underperformers with more seniority.,2024-08-11 13:07:42,32,FedEmployees,program_analyst_6
comment,ckw5ng,cazrp9,,"The problem is that 'specialized experience' is often just code for 'has a degree.' Coming from healthcare into federal service, the skills translation was the hardest part.",2024-08-26 04:23:15,24,govfire,think_tank_guy6948
post,92xf8e,92xf8e,The federal workforce is aging out — skills-based hiring is the answer,Skills-based hiring isn't just about removing degree requirements — it's about rethinking how we assess candidates entirely. Our union is actually supportive of skills-based hiring as long as it doesn't undermine seniority protections. I think we need to separate the discussion about RIFs from the discussion about hiring reform — they're related but different problems. The biggest misconception about skills-based hiring is that it lowers standards — it actually raises them by focusing on what matters.,2024-08-26 04:47:40,14,jobs,career_changer_43
comment,lx6dut,jcsexg,,Structured interviews were a game-changer for our hiring panel. Much more equitable. Great post. I'd add that the timeline issue is just as important as the degree requirements. I went through a RIF last year and ended up in a much better position. Don't give up.,2024-08-27 01:20:13,12,humanresources,contracting_pro
comment,8637zg,sn961j,,This tracks with the research from Opportunity@Work and other organizations studying STARs. This is why I left federal service — the bureaucracy around hiring and promotion was suffocating. The problem is that 'specialized experience' is often just code for 'has a degree.' The data from agencies that have piloted this is really encouraging.,2024-08-27 14:39:15,25,humanresources,IT_fed2173
comment,c9ros7,lom539,,"If we're serious about equity in federal hiring, skills-based approaches are essential. I'm in a STEM field and even here, practical skills matter more than coursework. The skills-based approach works in theory, but HR classification specialists often push back.",2024-08-30 10:46:24,16,feddiscussion,hr_manager_dc
post,u8s63e,u8s63e,Our classification system is from the 1940s — time for an overhaul,"The recent executive order on skills-based hiring is a step in the right direction, but implementation is going to be tough. The DOGE-driven workforce reductions are going to set back federal hiring reform by years. The federal government needs to invest in upskilling current employees, not just reforming external hiring. I know several STARs (Skilled Through Alternative Routes) who are better at their jobs than colleagues with advanced degrees. The problem with federal hiring reform is that every administration starts over instead of building on what worked before.",2024-09-02 06:33:30,3,jobs,mil_spouse_fed1237
post,cn0dl5,cn0dl5,Switching from private sector to federal — is USAJobs still a black hole?,"Federal hiring timelines destroy any goodwill that skills-based posting generates — by the time we make an offer, candidates have moved on. Our agency created a skills inventory for all employees last year and discovered incredible untapped talent. I know several STARs (Skilled Through Alternative Routes) who are better at their jobs than colleagues with advanced degrees. The federal government needs to invest in upskilling current employees, not just reforming external hiring. I've read the Opportunity@Work reports and the data is compelling — STARs perform just as well as workers with degrees.",2024-09-02 16:31:15,7,govfire,new_fed
post,296036,296036,Skills-based hiring won't work until we fix position classification,The recent layoffs feel targeted at specific demographics rather than based on actual performance or skills assessments. My team has been using structured interviews with skills-based rubrics and our retention rates have improved significantly. My agency piloted skills assessments last year and the quality of our hires improved dramatically.,2024-09-02 22:47:13,6,feddiscussion,policy_wonk
post,ny181a,ny181a,Skills-based hiring: real reform or just a buzzword?,Federal HR needs to stop treating degrees as a proxy for competence. The Opportunity@Work research shows that over 70 million workers in the US are STARs — the federal government should tap into that talent pool.,2024-09-03 10:48:50,3,jobs,retired_ses
comment,tpbn78,e5egty,,"The GS system was designed for a different era. Time to modernize. I'm in a STEM field and even here, practical skills matter more than coursework. The irony is that federal HR specialists themselves often don't have HR degrees. The federal government employs over 2 million people — even small improvements in hiring practices have huge impacts.",2024-09-04 19:56:15,12,humanresources,fed_employee_66
post,swm31y,swm31y,RIF survivors: how did you navigate the aftermath?,"OPM needs to update the qualification standards — many of them reference degrees that aren't even relevant anymore. Our agency just posted a GS-7 position that explicitly says 'degree OR equivalent experience.' I came from the private sector where nobody cared about my degree, and now I'm struggling with USAJobs.",2024-09-05 07:21:18,9,deptHHS,mil_spouse_fed
comment,3jonou,5nhqr6,,Same situation at my agency. We lost our best people in the RIF while keeping underperformers with more seniority. I appreciate this post. Sometimes it feels like we're shouting into the void on these issues. Skills taxonomies like the ones NICE and OPM are developing could standardize this across agencies.,2024-09-08 19:27:18,8,recruiting,union_steward
comment,4zw9xa,w8dt8c,,"Thank you for sharing your experience. These conversations are how we build momentum for change. The federal workforce planning data is clear: we need new approaches to attract and retain talent. This tracks with the research from Opportunity@Work and other organizations studying STARs. Coming from healthcare into federal service, the skills translation was the hardest part. I'd recommend looking into the recent OPM technical assistance materials on this.",2024-09-10 00:10:06,3,careerguidance,skills_first
comment,tn7e36,b5o1r9,,"I used to work in private sector HR and the contrast with federal hiring is staggering. OPM needs to lead on this, not just issue guidance and hope agencies comply. The GS system was designed for a different era. Time to modernize.",2024-09-13 23:41:36,6,recruiting,non_profit_to_gov
comment,u8s63e,gur9u1,,I've worked in three different agencies and the hiring culture varies wildly between them. The problem is that 'specialized experience' is often just code for 'has a degree.' This is a systemic issue. Individual agencies can only do so much without OPM reform. Totally agree. My agency just removed degree requirements for our entire IT series. Has anyone actually seen the quality of hires improve after switching to skills-based assessments?,2024-09-14 19:11:55,13,FedEmployees,career_changer7727
comment,r64dpj,we4c1v,,The real question is whether skills-based hiring survives the next administration change. My team just hired someone through a skills assessment pilot and they're one of our best performers.,2024-09-17 03:50:12,4,deptHHS,skills_first_33
post,09skdg,09skdg,RIF survivors: how did you navigate the aftermath?,"Competency-based assessments would fix a lot of the problems with self-certification questionnaires. The GS classification system desperately needs to incorporate skills-based elements. I've been in federal service for 3 years and the hiring process hasn't changed much. RIF procedures need to factor in critical skills retention, not just tenure and veterans preference.",2024-09-17 21:30:15,12,careerguidance,hiring_mgr_2
post,09skdg,09skdg,RIF survivors: how did you navigate the aftermath?,"Competency-based assessments would fix a lot of the problems with self-certification questionnaires. The GS classification system desperately needs to incorporate skills-based elements. I've been in federal service for 3 years and the hiring process hasn't changed much. RIF procedures need to factor in critical skills retention, not just tenure and veterans preference.",2024-09-17 21:30:15,12,careerguidance,hiring_mgr_2
comment,41ugl3,hz52qz,,I think the apprenticeship model is the most promising pathway for non-degree candidates. Has anyone actually seen the quality of hires improve after switching to skills-based assessments? This tracks with the research from Opportunity@Work and other organizations studying STARs. The biggest gap I see is in mid-career transitions. The system doesn't know what to do with career changers.,2024-09-20 14:35:18,22,govfire,union_steward
comment,72oy0i,2ftom5,,The DOGE cuts are making this even more urgent — we need to retain the skills we have left. Federal HR needs more training on how to evaluate non-traditional credentials. This tracks with the research from Opportunity@Work and other organizations studying STARs. Same situation at my agency. We lost our best people in the RIF while keeping underperformers with more seniority.,2024-09-24 17:21:02,21,deptHHS,policy_wonk_88
comment,c9ros7,f0dwwn,,"The DOGE cuts are making this even more urgent — we need to retain the skills we have left. If you're going through a RIF, document everything and contact your union rep immediately. Great post. I'd add that the timeline issue is just as important as the degree requirements. This is a systemic issue. Individual agencies can only do so much without OPM reform. This is why I left federal service — the bureaucracy around hiring and promotion was suffocating.",2024-09-27 06:51:39,3,feddiscussion,skills_first8877
comment,yhh6k6,2ab2rv,,The federal workforce planning data is clear: we need new approaches to attract and retain talent. I went through a RIF last year and ended up in a much better position. Don't give up. The federal government employs over 2 million people — even small improvements in hiring practices have huge impacts. This is such an important conversation. Federal hiring reform has bipartisan support for a reason.,2024-09-28 07:29:38,9,govfire,program_analyst_14
comment,3jonou,64fgwj,,The real question is whether skills-based hiring survives the next administration change. This is a systemic issue. Individual agencies can only do so much without OPM reform.,2024-09-28 11:12:28,23,feddiscussion,resume_guru_86
comment,okzixz,gg5gr0,,I've been saying this for years — the federal hiring system is fundamentally broken. I think the apprenticeship model is the most promising pathway for non-degree candidates. This is such an important conversation. Federal hiring reform has bipartisan support for a reason. The real question is whether skills-based hiring survives the next administration change.,2024-09-29 03:46:13,4,jobs,hiring_mgr
post,vxdp5g,vxdp5g,Federal hiring managers: do you actually care about degrees?,"We lost three of our best analysts in the last RIF because they were the most junior, not the least skilled. The Opportunity@Work research shows that over 70 million workers in the US are STARs — the federal government should tap into that talent pool. The biggest misconception about skills-based hiring is that it lowers standards — it actually raises them by focusing on what matters. If the private sector can move to skills-based hiring, there's no reason the federal government can't. Our agency created a skills inventory for all employees last year and discovered incredible untapped talent.",2024-10-06 23:07:43,4,feddiscussion,policy_wonk
comment,u0dk0g,klv69e,,"RIF procedures are governed by law, not just regulation — changing them requires Congressional action. This is a systemic issue. Individual agencies can only do so much without OPM reform. Totally agree. My agency just removed degree requirements for our entire IT series. The skills-based approach works in theory, but HR classification specialists often push back. I used to work in private sector HR and the contrast with federal hiring is staggering.",2024-10-12 09:36:35,47,deptHHS,healthcare_admin5224
comment,t4p501,5jz6kf,,"As a hiring manager, I can confirm that we lose great candidates to the private sector constantly. The GS system was designed for a different era. Time to modernize. Structured interviews were a game-changer for our hiring panel. Much more equitable.",2024-10-15 03:06:15,4,careerguidance,resume_guru_34
comment,lh62c9,odwmqx,,This is such an important conversation. Federal hiring reform has bipartisan support for a reason. The real question is whether skills-based hiring survives the next administration change.,2024-10-18 10:33:55,2,govfire,program_analyst_77
comment,okep7y,0v5dta,,This is exactly my experience too. This is such an important conversation. Federal hiring reform has bipartisan support for a reason.,2024-10-18 17:28:13,5,careerguidance,usajobs_veteran5910
post,dd1vn8,dd1vn8,Opportunity@Work's research on STARs is eye-opening,"I went through a RIF in 2024 and it was the most stressful experience of my career. The DOGE-driven workforce reductions are going to set back federal hiring reform by years. The federal government needs to invest in upskilling current employees, not just reforming external hiring.",2024-10-19 19:07:52,13,humanresources,star_advocate9943
comment,poyipk,fn07ea,,"I went through a RIF last year and ended up in a much better position. Don't give up. The federal government employs over 2 million people — even small improvements in hiring practices have huge impacts. The federal workforce planning data is clear: we need new approaches to attract and retain talent. If you're going through a RIF, document everything and contact your union rep immediately.",2024-10-21 01:52:25,5,humanresources,eeo_officer_2
comment,pcn9t8,rbkn3d,,"I appreciate this post. Sometimes it feels like we're shouting into the void on these issues. I went from enlisted military to GS-5 with no degree. The system can work, but it's harder than it should be. I know several people who were RIF'd and are now making more money in the private sector. Silver lining, I guess. I've been saying this for years — the federal hiring system is fundamentally broken.",2024-10-22 03:48:47,4,jobs,program_analyst
comment,bdje15,skufrc,,This is exactly my experience too. Skills taxonomies like the ones NICE and OPM are developing could standardize this across agencies. Great post. I'd add that the timeline issue is just as important as the degree requirements. Same situation at my agency. We lost our best people in the RIF while keeping underperformers with more seniority.,2024-10-22 16:01:39,16,FedEmployees,gov_analyst_33
comment,ahym2z,0i85sy,,"I'm in a STEM field and even here, practical skills matter more than coursework. This is a systemic issue. Individual agencies can only do so much without OPM reform.",2024-10-28 00:55:34,5,jobs,budget_hawk
post,ftu2gc,ftu2gc,HHS just restructured — anyone know what's happening with hiring?,"HHS is going through massive changes right now and it's not clear how hiring reform fits into the picture. I'm a hiring manager and I wish I could post positions based purely on demonstrated skills, but OPM standards won't let me. OPM needs to update the qualification standards — many of them reference degrees that aren't even relevant anymore.",2024-11-01 21:37:26,9,FedEmployees,think_tank_guy
post,fy6452,fy6452,RIF survivors: how did you navigate the aftermath?,The problem with federal hiring reform is that every administration starts over instead of building on what worked before. I think we need to separate the discussion about RIFs from the discussion about hiring reform — they're related but different problems. The biggest misconception about skills-based hiring is that it lowers standards — it actually raises them by focusing on what matters.,2024-11-03 01:06:06,12,recruiting,hill_staffer_79
comment,ve92mp,c11bd2,,"RIF procedures are governed by law, not just regulation — changing them requires Congressional action. Totally agree. My agency just removed degree requirements for our entire IT series.",2024-11-03 01:25:33,25,FedEmployees,hiring_mgr
post,zhwy9h,zhwy9h,Switching from private sector to federal — is USAJobs still a black hole?,Our union is actually supportive of skills-based hiring as long as it doesn't undermine seniority protections. Competency-based assessments would fix a lot of the problems with self-certification questionnaires.,2024-11-03 10:52:19,13,recruiting,dc_commuter_71
post,cc5o7u,cc5o7u,The federal workforce is aging out — skills-based hiring is the answer,"Certification programs like CompTIA, PMP, and SHRM should carry more weight in federal qualification standards. I've seen incredibly talented people get screened out because they don't have a bachelor's degree.",2024-11-06 09:11:38,15,recruiting,agency_hopper
comment,c3c54w,h1xdpz,,"My team just hired someone through a skills assessment pilot and they're one of our best performers. I went from enlisted military to GS-12 with no degree. The system can work, but it's harder than it should be. The federal workforce planning data is clear: we need new approaches to attract and retain talent.",2024-11-07 17:49:39,10,feddiscussion,fed_employee
comment,c3c54w,zpqkf4,,The real question is whether skills-based hiring survives the next administration change. This tracks with the research from Opportunity@Work and other organizations studying STARs.,2024-11-08 23:18:49,5,FedEmployees,union_steward_20
comment,v3i12v,v239mo,,"Great post. I'd add that the timeline issue is just as important as the degree requirements. Skills-based hiring + remote work could transform the geographic diversity of the federal workforce. I know several people who were RIF'd and are now making more money in the private sector. Silver lining, I guess.",2024-11-09 08:17:53,25,feddiscussion,talent_scout
comment,8uyo57,ahk2ls,,The federal workforce planning data is clear: we need new approaches to attract and retain talent. This is exactly my experience too. Totally agree. My agency just removed degree requirements for our entire IT series. I've been following the Opportunity@Work research closely and it's changing how I think about hiring.,2024-11-10 15:36:32,7,careerguidance,non_profit_to_gov_5
