type,thread_id,id,title,body,created_utc,score,subreddit,author
comment,t05uir,h9ptfn,,Same situation at my agency. We lost our best people in the RIF while keeping underperformers with more seniority. I'd recommend looking into the recent OPM technical assistance materials on this. I've been following the Opportunity@Work research closely and it's changing how I think about hiring. I'm cautiously optimistic. The bipartisan STARS Act could be a real turning point.,2021-11-15 08:23:11,11,careerguidance,think_tank_guy_53
comment,8krd5e,fibjzp,,Great post. I'd add that the timeline issue is just as important as the degree requirements. This is why I left federal service — the bureaucracy around hiring and promotion was suffocating. Counterpoint: some positions genuinely require advanced education and we shouldn't throw the baby out with the bathwater. The biggest gap I see is in mid-career transitions. The system doesn't know what to do with career changers. Skills-based hiring + remote work could transform the geographic diversity of the federal workforce.,2021-12-03 14:05:44,4,govfire,gs13_life_96
comment,ykl1cq,zsu8e6,,I think the apprenticeship model is the most promising pathway for non-degree candidates. The irony is that federal HR specialists themselves often don't have HR degrees. Federal hiring reform needs champions at the SES level to actually move the needle.,2022-01-01 01:19:53,2,govfire,eeo_officer
comment,1jhuwb,t94ow3,,"The GS system was designed for a different era. Time to modernize. The federal government employs over 2 million people — even small improvements in hiring practices have huge impacts. I'm cautiously optimistic. The bipartisan STARS Act could be a real turning point. If you're going through a RIF, document everything and contact your union rep immediately.",2022-01-01 07:17:36,7,FedEmployees,resume_guru267
comment,okzixz,nne6it,,This tracks with the research from Opportunity@Work and other organizations studying STARs. I think the apprenticeship model is the most promising pathway for non-degree candidates.,2022-01-04 11:18:03,49,jobs,star_advocate
comment,yn2jcp,i0pt2d,,The irony is that federal HR specialists themselves often don't have HR degrees. This is a systemic issue. Individual agencies can only do so much without OPM reform.,2022-01-09 03:13:22,55,recruiting,new_fed
comment,yn2jcp,i0pt2d,,The irony is that federal HR specialists themselves often don't have HR degrees. This is a systemic issue. Individual agencies can only do so much without OPM reform.,2022-01-09 03:13:22,55,recruiting,new_fed
comment,heyr8l,64caqk,,This is exactly my experience too. Counterpoint: some positions genuinely require advanced education and we shouldn't throw the baby out with the bathwater.,2022-01-14 18:27:50,13,feddiscussion,retired_ses
comment,poyipk,gb6p8k,,"Counterpoint: some positions genuinely require advanced education and we shouldn't throw the baby out with the bathwater. The data from agencies that have piloted this is really encouraging. RIF procedures are governed by law, not just regulation — changing them requires Congressional action.",2022-01-16 10:16:24,7,deptHHS,dc_commuter9477
comment,ckw5ng,qqpwdx,,Skills taxonomies like the ones NICE and OPM are developing could standardize this across agencies. My agency's HR office still thinks removing degree requirements will lower the quality of applicants.,2022-01-20 02:09:05,48,feddiscussion,class_act_rep
comment,e4261b,wncnpi,,Great post. I'd add that the timeline issue is just as important as the degree requirements. Federal HR needs more training on how to evaluate non-traditional credentials. The irony is that federal HR specialists themselves often don't have HR degrees. The biggest gap I see is in mid-career transitions. The system doesn't know what to do with career changers. I've been following the Opportunity@Work research closely and it's changing how I think about hiring.,2022-01-20 03:58:16,18,feddiscussion,career_changer_83
comment,zlm72j,9ociil,,"If we're serious about equity in federal hiring, skills-based approaches are essential. The skills-based approach works in theory, but HR classification specialists often push back.",2022-01-31 14:54:58,7,recruiting,policy_wonk6921
post,c89k8y,c89k8y,"The case for paying federal employees based on skills, not grades",I've been coaching people through the federal hiring process for 9 years and the biggest barrier is always the degree requirement. I've seen the same position classified at GS-9 in one agency and GS-13 in another — the system is broken. I transitioned from a trade job to federal IT and the hardest part was translating my experience into federal resume language. Skills-based hiring isn't just about removing degree requirements — it's about rethinking how we assess candidates entirely.,2022-02-04 01:58:02,3,jobs,union_steward9272
comment,swm31y,eb8753,,"The DOGE cuts are making this even more urgent — we need to retain the skills we have left. If we're serious about equity in federal hiring, skills-based approaches are essential.",2022-02-05 08:06:40,6,recruiting,star_advocate
post,pqkojt,pqkojt,RIF layoffs are devastating our institutional knowledge,"The recent layoffs feel targeted at specific demographics rather than based on actual performance or skills assessments. I came from the private sector where nobody cared about my degree, and now I'm struggling with USAJobs.",2022-02-10 04:18:47,14,feddiscussion,public_servant9424
post,q06wpx,q06wpx,RIF notice received — what are my options?,"Skills-based hiring is especially important for cybersecurity roles where the field evolves faster than any degree program can keep up. I built my entire career through self-study and on-the-job learning, and I'm now a GS-9 making more than most of my degreed colleagues.",2022-02-18 09:00:23,1,govfire,eeo_officer
post,nhj7xv,nhj7xv,Just got my first federal offer — GS-7 with no degree!,The RIF process is brutal and seems to penalize newer employees regardless of their actual skills or contributions. The biggest misconception about skills-based hiring is that it lowers standards — it actually raises them by focusing on what matters. I've seen the same position classified at GS-9 in one agency and GS-13 in another — the system is broken.,2022-02-19 20:47:01,47,recruiting,vet_preference
comment,cc5o7u,gbmfbu,,"The DOGE cuts are making this even more urgent — we need to retain the skills we have left. I went through a RIF last year and ended up in a much better position. Don't give up. As a hiring manager, I can confirm that we lose great candidates to the private sector constantly. OPM needs to lead on this, not just issue guidance and hope agencies comply.",2022-02-25 16:12:49,26,feddiscussion,usajobs_veteran_42
comment,qot8hl,sb6zwk,,The problem is that 'specialized experience' is often just code for 'has a degree.' My agency's HR office still thinks removing degree requirements will lower the quality of applicants. Has anyone actually seen the quality of hires improve after switching to skills-based assessments?,2022-02-25 17:14:37,19,deptHHS,hill_staffer
post,0w10lb,0w10lb,Has anyone used the new pathways program without a degree?,"The federal government needs to invest in upskilling current employees, not just reforming external hiring. Competency-based assessments would fix a lot of the problems with self-certification questionnaires. Federal hiring timelines destroy any goodwill that skills-based posting generates — by the time we make an offer, candidates have moved on. I've read the Opportunity@Work reports and the data is compelling — STARs perform just as well as workers with degrees.",2022-02-27 10:51:20,48,humanresources,skills_first
comment,cn0dl5,bjeqvv,,I'm cautiously optimistic. The bipartisan STARS Act could be a real turning point. I've been saying this for years — the federal hiring system is fundamentally broken. This tracks with the research from Opportunity@Work and other organizations studying STARs.,2022-02-27 11:45:55,14,FedEmployees,contracting_pro
comment,pcn9t8,e60qra,,Everyone talks about skills-based hiring but nobody talks about skills-based promotion. The federal government employs over 2 million people — even small improvements in hiring practices have huge impacts. I'd recommend looking into the recent OPM technical assistance materials on this. This tracks with the research from Opportunity@Work and other organizations studying STARs. I'm cautiously optimistic. The bipartisan STARS Act could be a real turning point.,2022-02-27 12:06:06,6,careerguidance,vet_preference8410
comment,wovcxe,g3aut3,,"The skills-based approach works in theory, but HR classification specialists often push back. My agency's HR office still thinks removing degree requirements will lower the quality of applicants. Everyone talks about skills-based hiring but nobody talks about skills-based promotion. If you're going through a RIF, document everything and contact your union rep immediately. The biggest gap I see is in mid-career transitions. The system doesn't know what to do with career changers.",2022-03-02 19:21:46,10,govfire,hr_specialist
comment,fy6452,rqgkcu,,"I went through a RIF last year and ended up in a much better position. Don't give up. The skills-based approach works in theory, but HR classification specialists often push back. The real question is whether skills-based hiring survives the next administration change. The biggest gap I see is in mid-career transitions. The system doesn't know what to do with career changers.",2022-03-03 12:07:14,3,recruiting,resume_guru6701
comment,fy6452,rqgkcu,,"I went through a RIF last year and ended up in a much better position. Don't give up. The skills-based approach works in theory, but HR classification specialists often push back. The real question is whether skills-based hiring survives the next administration change. The biggest gap I see is in mid-career transitions. The system doesn't know what to do with career changers.",2022-03-03 12:07:14,3,recruiting,resume_guru6701
comment,rxyj38,7187f8,,"Coming from healthcare into federal service, the skills translation was the hardest part. The biggest gap I see is in mid-career transitions. The system doesn't know what to do with career changers. This tracks with the research from Opportunity@Work and other organizations studying STARs. RIF procedures are governed by law, not just regulation — changing them requires Congressional action.",2022-03-04 06:19:29,6,govfire,management_analyst
comment,sujt9t,rkdvnj,,"If we're serious about equity in federal hiring, skills-based approaches are essential. OPM needs to lead on this, not just issue guidance and hope agencies comply. Skills taxonomies like the ones NICE and OPM are developing could standardize this across agencies. The data from agencies that have piloted this is really encouraging. I'm in a STEM field and even here, practical skills matter more than coursework.",2022-03-08 05:25:42,6,recruiting,fed_employee_60
post,7s3kkv,7s3kkv,Federal telework policies are driving away skilled workers,"OPM needs to update the qualification standards — many of them reference degrees that aren't even relevant anymore. Our union is actually supportive of skills-based hiring as long as it doesn't undermine seniority protections. Federal employees who got RIF'd should get priority consideration through a skills-matching program, not just bumping rights. I transitioned from a trade job to federal IT and the hardest part was translating my experience into federal resume language. My team has been using structured interviews with skills-based rubrics and our retention rates have improved significantly.",2022-03-09 19:17:21,23,recruiting,non_profit_to_gov_91
comment,v1xg1r,lc83gy,,I appreciate this post. Sometimes it feels like we're shouting into the void on these issues. This tracks with the research from Opportunity@Work and other organizations studying STARs. My team just hired someone through a skills assessment pilot and they're one of our best performers.,2022-03-10 00:08:04,97,govfire,workforce_dev
comment,bo119x,hg9ncb,,I'm a STAR and I've been a top performer for 16 years. Degrees don't determine competence. This tracks with the research from Opportunity@Work and other organizations studying STARs.,2022-03-10 04:53:25,8,FedEmployees,skills_first
post,cqmrun,cqmrun,Federal hiring managers: do you actually care about degrees?,"The tech industry has been moving away from degree requirements for years — Google, Apple, IBM all dropped them. I've read the Opportunity@Work reports and the data is compelling — STARs perform just as well as workers with degrees.",2022-03-10 09:51:07,18,FedEmployees,agency_hopper_6
comment,8sryo4,d20j1o,,"I know several people who were RIF'd and are now making more money in the private sector. Silver lining, I guess. I appreciate this post. Sometimes it feels like we're shouting into the void on these issues. As a hiring manager, I can confirm that we lose great candidates to the private sector constantly. Structured interviews were a game-changer for our hiring panel. Much more equitable.",2022-03-16 07:23:22,11,FedEmployees,fed_employee5289
comment,gox22i,gnxb5j,,"The GS system was designed for a different era. Time to modernize. As a hiring manager, I can confirm that we lose great candidates to the private sector constantly.",2022-03-16 22:19:59,28,feddiscussion,new_fed
comment,296036,hbyhz4,,"I went from enlisted military to GS-15 with no degree. The system can work, but it's harder than it should be. If we're serious about equity in federal hiring, skills-based approaches are essential.",2022-03-17 14:21:04,7,jobs,skills_first
post,f5l9mo,f5l9mo,Our classification system is from the 1940s — time for an overhaul,"The data on skills-based hiring outcomes is really promising — agencies that adopt it see better diversity and performance metrics. My experience going through the Pathways program showed me how much the federal government values credentials over capability. Skills-based hiring isn't just about removing degree requirements — it's about rethinking how we assess candidates entirely. We lost three of our best analysts in the last RIF because they were the most junior, not the least skilled.",2022-03-20 14:42:07,16,humanresources,mil_spouse_fed
comment,t05uir,rimr25,,"I've been saying this for years — the federal hiring system is fundamentally broken. As a hiring manager, I can confirm that we lose great candidates to the private sector constantly. The federal workforce planning data is clear: we need new approaches to attract and retain talent.",2022-03-22 23:56:08,13,jobs,mil_spouse_fed_90
comment,v3i12v,0a0uy9,,"I went from enlisted military to GS-5 with no degree. The system can work, but it's harder than it should be. I'm in a STEM field and even here, practical skills matter more than coursework. I've been following the Opportunity@Work research closely and it's changing how I think about hiring.",2022-03-23 12:18:08,8,feddiscussion,tech_to_fed5545
comment,sujt9t,93n0aj,,I'm a STAR and I've been a top performer for 16 years. Degrees don't determine competence. My team just hired someone through a skills assessment pilot and they're one of our best performers.,2022-03-24 03:49:11,16,humanresources,cyber_fed
post,3z6bz8,3z6bz8,Skills taxonomies: how should agencies define competencies?,"The tech industry has been moving away from degree requirements for years — Google, Apple, IBM all dropped them. I've been coaching people through the federal hiring process for 7 years and the biggest barrier is always the degree requirement. HHS is going through massive changes right now and it's not clear how hiring reform fits into the picture.",2022-03-29 06:05:38,14,deptHHS,eeo_officer326
comment,rrpzlk,fk043b,,"I think the apprenticeship model is the most promising pathway for non-degree candidates. The real barrier isn't policy — it's culture. Hiring managers need to believe in skills-based approaches. If we're serious about equity in federal hiring, skills-based approaches are essential. Totally agree. My agency just removed degree requirements for our entire IT series.",2022-04-02 08:41:31,7,recruiting,budget_hawk3450
comment,1sdw4s,4ljedg,,The real question is whether skills-based hiring survives the next administration change. I used to work in private sector HR and the contrast with federal hiring is staggering. The federal workforce planning data is clear: we need new approaches to attract and retain talent.,2022-04-02 12:27:47,10,recruiting,workforce_dev_4
comment,iyzcot,czsx0g,,The real question is whether skills-based hiring survives the next administration change. The biggest gap I see is in mid-career transitions. The system doesn't know what to do with career changers. The problem is that 'specialized experience' is often just code for 'has a degree.' I'd recommend looking into the recent OPM technical assistance materials on this.,2022-04-02 15:00:38,63,govfire,skills_first_34
comment,swm31y,upuy0z,,Federal HR needs more training on how to evaluate non-traditional credentials. This is exactly my experience too. Same situation at my agency. We lost our best people in the RIF while keeping underperformers with more seniority.,2022-04-03 13:12:21,52,recruiting,cyber_fed_18
comment,yr6ccv,t1tw9z,,"I went from enlisted military to GS-5 with no degree. The system can work, but it's harder than it should be. Everyone talks about skills-based hiring but nobody talks about skills-based promotion.",2022-04-04 09:03:54,14,humanresources,skills_first
comment,obk3g8,65b4ey,,"Thank you for sharing your experience. These conversations are how we build momentum for change. My agency's HR office still thinks removing degree requirements will lower the quality of applicants. Skills taxonomies like the ones NICE and OPM are developing could standardize this across agencies. As a hiring manager, I can confirm that we lose great candidates to the private sector constantly. I went through a RIF last year and ended up in a much better position. Don't give up.",2022-04-05 13:12:11,5,feddiscussion,class_act_rep8369
comment,kef828,2y77z6,,Everyone talks about skills-based hiring but nobody talks about skills-based promotion. This is exactly my experience too.,2022-04-07 22:50:03,6,recruiting,management_analyst13
comment,r64dpj,94d6ru,,"The real question is whether skills-based hiring survives the next administration change. I appreciate this post. Sometimes it feels like we're shouting into the void on these issues. I went from enlisted military to GS-15 with no degree. The system can work, but it's harder than it should be. The federal workforce planning data is clear: we need new approaches to attract and retain talent. Counterpoint: some positions genuinely require advanced education and we shouldn't throw the baby out with the bathwater.",2022-04-09 09:20:20,6,humanresources,data_nerd_gov8598
comment,eixwc4,jdxo10,,My agency's HR office still thinks removing degree requirements will lower the quality of applicants. The DOGE cuts are making this even more urgent — we need to retain the skills we have left. I've been following the Opportunity@Work research closely and it's changing how I think about hiring.,2022-04-16 13:25:57,52,FedEmployees,new_fed
post,ykl1cq,ykl1cq,Skills taxonomies: how should agencies define competencies?,"My supervisor told me they had to fight HR just to remove the degree requirement from our latest posting. Federal employees who got RIF'd should get priority consideration through a skills-matching program, not just bumping rights.",2022-04-17 20:43:33,2,deptHHS,cyber_fed_37
post,6qicat,6qicat,The federal workforce is aging out — skills-based hiring is the answer,"I've been in federal service for 22 years and the hiring process hasn't changed much. My supervisor told me they had to fight HR just to remove the degree requirement from our latest posting. RIF procedures need to factor in critical skills retention, not just tenure and veterans preference.",2022-04-21 01:45:12,7,deptHHS,union_steward
comment,nhj7xv,rml29q,,The DOGE cuts are making this even more urgent — we need to retain the skills we have left. I went through a RIF last year and ended up in a much better position. Don't give up.,2022-04-21 21:24:51,9,careerguidance,workforce_dev_25
comment,1sdw4s,zvrctl,,"I've been saying this for years — the federal hiring system is fundamentally broken. Great post. I'd add that the timeline issue is just as important as the degree requirements. The DOGE cuts are making this even more urgent — we need to retain the skills we have left. As a hiring manager, I can confirm that we lose great candidates to the private sector constantly. Federal hiring reform needs champions at the SES level to actually move the needle.",2022-04-22 21:36:09,34,FedEmployees,budget_hawk_63
post,rlw3mg,rlw3mg,Opportunity@Work's research on STARs is eye-opening,Our agency just posted a GS-9 position that explicitly says 'degree OR equivalent experience.' OPM needs to update the qualification standards — many of them reference degrees that aren't even relevant anymore.,2022-04-23 16:10:27,15,recruiting,vet_preference_76
comment,jn2fom,kjf4aq,,Great post. I'd add that the timeline issue is just as important as the degree requirements. I'm a STAR and I've been a top performer for 22 years. Degrees don't determine competence. My team just hired someone through a skills assessment pilot and they're one of our best performers.,2022-04-24 05:11:34,140,recruiting,healthcare_admin3012
comment,qpgb7r,pswldo,,"I used to work in private sector HR and the contrast with federal hiring is staggering. I've been following the Opportunity@Work research closely and it's changing how I think about hiring. Great post. I'd add that the timeline issue is just as important as the degree requirements. I appreciate this post. Sometimes it feels like we're shouting into the void on these issues. Coming from healthcare into federal service, the skills translation was the hardest part.",2022-04-24 08:50:32,22,deptHHS,mil_spouse_fed_60
post,t4p501,t4p501,Veterans preference + skills-based hiring = the future?,"Skills-based hiring would particularly benefit veterans who have incredible real-world experience but may not have traditional credentials. The recent executive order on skills-based hiring is a step in the right direction, but implementation is going to be tough.",2022-04-25 05:27:44,7,jobs,tech_to_fed_58
post,ahym2z,ahym2z,RIF notice received — what are my options?,"Our union is actually supportive of skills-based hiring as long as it doesn't undermine seniority protections. I mentored a young person who had amazing data analytics skills but couldn't get past the HR screen because of the degree filter. The federal apprenticeship programs are a great model for skills-based entry, but they need to be scaled up. The RIF process is brutal and seems to penalize newer employees regardless of their actual skills or contributions. HHS is going through massive changes right now and it's not clear how hiring reform fits into the picture.",2022-04-25 12:05:06,3,FedEmployees,resume_guru_3
post,grp2u4,grp2u4,STARs (Skilled Through Alternative Routes) — has this concept reached federal HR?,My agency piloted skills assessments last year and the quality of our hires improved dramatically. The Opportunity@Work research shows that over 70 million workers in the US are STARs — the federal government should tap into that talent pool.,2022-04-26 11:53:47,66,humanresources,program_analyst
comment,wovcxe,syxbbf,,The problem is that 'specialized experience' is often just code for 'has a degree.' The GS system was designed for a different era. Time to modernize. Skills-based hiring + remote work could transform the geographic diversity of the federal workforce.,2022-04-26 12:19:44,19,humanresources,telework_fan_49
post,hafeyu,hafeyu,"The real problem with federal hiring isn't degrees, it's the timeline","The problem with federal hiring reform is that every administration starts over instead of building on what worked before. Federal HR needs to stop treating degrees as a proxy for competence. Federal hiring timelines destroy any goodwill that skills-based posting generates — by the time we make an offer, candidates have moved on. The problem isn't just degrees — it's that federal job announcements are written in incomprehensible bureaucratic language. The RIF process is brutal and seems to penalize newer employees regardless of their actual skills or contributions.",2022-04-29 01:21:14,17,deptHHS,hiring_mgr4941
comment,tn7e36,zivzg9,,"The real barrier isn't policy — it's culture. Hiring managers need to believe in skills-based approaches. This tracks with the research from Opportunity@Work and other organizations studying STARs. Skills-based hiring is meaningless if the pay scale doesn't reflect market value for those skills. I'm in a STEM field and even here, practical skills matter more than coursework. My agency's HR office still thinks removing degree requirements will lower the quality of applicants.",2022-04-30 03:19:48,38,deptHHS,career_changer
comment,41ugl3,o7002g,,"The GS system was designed for a different era. Time to modernize. Coming from healthcare into federal service, the skills translation was the hardest part.",2022-05-02 21:50:57,12,FedEmployees,contracting_pro_45
comment,yr6ccv,ic0lzi,,The GS system was designed for a different era. Time to modernize. The federal government employs over 2 million people — even small improvements in hiring practices have huge impacts. I think the apprenticeship model is the most promising pathway for non-degree candidates.,2022-05-05 07:12:41,28,recruiting,vet_preference_49
